{
  "dry_run": true,
  "poll_seconds": 20,
  "idle_minutes": 30,
  "broadcast": "192.0.2.255",
  "metrics_listen": "0.0.0.0:9105",
  "state_file": "/var/lib/rackctl/last-online.json",
  "ssh_key": "/etc/rackctl/id_ed25519",
  "known_hosts": "/etc/rackctl/known_hosts",
  "sources": [
    {
      "runners_path": "repos/example-org/app",
      "repos": [
        "example-org/app"
      ],
      "token_file": "/etc/rackctl/token-example-org"
    },
    {
      "runners_path": "orgs/example-org2",
      "repos": [
        "example-org2/repo-a",
        "example-org2/repo-b"
      ],
      "token_file": "/etc/rackctl/token-example-org2"
    }
  ],
  "machines": [
    {
      "name": "host1",
      "mac": "00:00:5e:00:53:01",
      "host": "192.0.2.11",
      "ssh_user": "rackctl",
      "runner_prefixes": [
        "host1-a-",
        "host1-b-"
      ],
      "rank": 1
    },
    {
      "name": "host2",
      "mac": "00:00:5e:00:53:02",
      "host": "192.0.2.12",
      "ssh_user": "rackctl",
      "runner_prefixes": [
        "host2-a-"
      ],
      "rank": 1
    },
    {
      "name": "host3",
      "mac": "00:00:5e:00:53:03",
      "host": "192.0.2.13",
      "ssh_user": "rackctl",
      "runner_prefixes": [
        "host3-a-"
      ],
      "rank": 2
    }
  ]
}
